{
  "slug": "erpnext",
  "name": "erpnext",
  "title": "ERPNext",
  "description": "Free and open source ERP system built on Frappe Framework, covering accounting, inventory, manufacturing, CRM, HR, and more.",
  "repository": "https://github.com/frappe/erpnext",
  "license": "GPL-3.0",
  "min_frappe_version": "14.0.0",
  "frappe_versions": [
    "14",
    "15",
    "16"
  ],
  "install_branches": {
    "14": "version-14",
    "15": "version-15",
    "16": "develop"
  },
  "required_apps": [
    "frappe"
  ],
  "categories": [
    "Accounting",
    "Business",
    "Human Resources",
    "Customer Relations"
  ],
  "tags": [
    "erp",
    "accounting",
    "inventory",
    "manufacturing",
    "crm",
    "hr",
    "payroll"
  ],
  "install_commands": [
    "bench get-app https://github.com/frappe/erpnext",
    "bench --site [site-name] install-app erpnext",
    "bench --site [site-name] migrate",
    "bench restart"
  ],
  "links": {
    "docs": "https://docs.erpnext.com",
    "demo": "https://demo.erpnext.com",
    "website": "https://erpnext.com"
  },
  "media": {
    "icon": "https://raw.githubusercontent.com/frappe/erpnext/develop/erpnext/public/images/erpnext-logo.png",
    "screenshots": [
      "https://github.com/frappe/erpnext/blob/develop/erpnext/public/images/v16/hero_image.png?raw=true"
    ]
  },
  "meta": {
    "source": "manual",
    "verified": true,
    "status": "active",
    "added_at": "2026-06-09"
  }
}
