{
  "slug": "wiki",
  "name": "wiki",
  "title": "Frappe Wiki",
  "description": "A collaborative wiki and knowledge base app for Frappe, with rich text editing, versioning, and hierarchical organization of content.",
  "repository": "https://github.com/frappe/wiki",
  "license": "AGPL-3.0",
  "min_frappe_version": "14.0.0",
  "frappe_versions": [
    "14",
    "15",
    "16"
  ],
  "install_branches": {
    "14": "version-14",
    "15": "develop",
    "16": "develop"
  },
  "required_apps": [
    "frappe"
  ],
  "categories": [
    "Utilities"
  ],
  "tags": [
    "wiki",
    "docs",
    "knowledge-base",
    "collaboration"
  ],
  "install_commands": [
    "bench get-app https://github.com/frappe/wiki",
    "bench --site [site-name] install-app wiki",
    "bench --site [site-name] migrate",
    "bench restart"
  ],
  "links": {
    "docs": "https://github.com/frappe/wiki#readme",
    "website": "https://frappe.io"
  },
  "media": {
    "icon": "https://raw.githubusercontent.com/frappe/wiki/develop/frontend/src/assets/wiki-logo.png",
    "screenshots": [
      "https://frappe.io/files/W1%20(1).webp"
    ]
  },
  "meta": {
    "source": "manual",
    "verified": true,
    "status": "active",
    "added_at": "2026-06-09"
  }
}
