{
  "slug": "insights",
  "name": "insights",
  "title": "Frappe Insights",
  "description": "Open source business intelligence and data analytics tool for Frappe, with a drag-and-drop query builder, charts, and dashboards.",
  "repository": "https://github.com/frappe/insights",
  "license": "AGPL-3.0",
  "min_frappe_version": "14.0.0",
  "frappe_versions": [
    "14",
    "15",
    "16"
  ],
  "install_branches": {
    "14": "version-14",
    "15": "version-15",
    "16": "develop"
  },
  "required_apps": [
    "frappe"
  ],
  "categories": [
    "Analytics"
  ],
  "tags": [
    "analytics",
    "bi",
    "charts",
    "dashboard",
    "data",
    "reports"
  ],
  "install_commands": [
    "bench get-app https://github.com/frappe/insights",
    "bench --site [site-name] install-app insights",
    "bench --site [site-name] migrate",
    "bench restart"
  ],
  "links": {
    "docs": "https://docs.frappe.io/insights",
    "demo": "https://insights.frappe.io",
    "website": "https://frappe.io/insights"
  },
  "media": {
    "icon": "https://raw.githubusercontent.com/frappe/insights/refs/heads/develop/frontend/public/favicon.png",
    "screenshots": [
      "https://raw.githubusercontent.com/frappe/insights/refs/heads/develop/.github/hero-image.png"
    ]
  },
  "meta": {
    "source": "manual",
    "verified": true,
    "status": "active",
    "added_at": "2026-06-09"
  }
}
